{
  "source_id": "2fbef5f7-1c21-434c-9b4e-060399d3dab3",
  "source_key": "lrt-jakarta-official-network-publication",
  "name": "LRT Jakarta official network publication",
  "provider": "PT LRT Jakarta",
  "source_type": "HTML_PRESS_RELEASE",
  "canonical_url": "https://dishub.jakarta.go.id/sejak-diresmikan-lrt-jakarta-kelapa-gading-manggarai-layani-100-343-penumpang/",
  "license_record": "data/licenses/phase-1-multi-operator-source-rights.md",
  "access_method": "OFFICIAL_WEB_PUBLICATION",
  "access_notes": "The official Jakarta transport authority publication dated 2026-09-25 confirms current limited operation: Kelapa Gading–Manggarai 05:30–20:00 at 15-minute headway, then Kelapa Gading–Velodrome 20:01–23:00. LRT Jakarta robots rules disallow automated retrieval, so operator-site crawling is not used. No explicit restriction on local noncommercial academic processing of the public facts was found; redistribution remains unknown.",
  "coverage_notes": "Current post-expansion topology is 11 stations to Manggarai. Rawamangun, Pramuka, and Manggarai serve passengers during limited operation; Matraman and Proklamasi remain explicit pass-through stations. A local frequency-derived research representation is validated without claiming exact departures.",
  "redistribution_rule": "The official privacy/copyright page reserves rights; no open-data or redistribution permission was found.",
  "verification_status": "VERIFIED",
  "source_class": "C_OFFICIAL_REUSE_OR_AUTOMATION_UNCLEAR",
  "license_status": "UNKNOWN",
  "redistribution_status": "UNKNOWN",
  "automation_status": "PROHIBITED",
  "data_format": "HTML",
  "machine_readability": "DOCUMENT_ONLY",
  "schedule_status": "LOCAL_FREQUENCY_DERIVED_RESEARCH_SNAPSHOT",
  "topology_status": "TOPOLOGY_ONLY",
  "geometry_status": "NOT_AVAILABLE",
  "service_calendar_status": "OPERATING_WINDOW_ONLY",
  "freshness": "Official current limited-operation facts were published on 2026-09-25 and reviewed on 2026-10-01; stable machine access is not available.",
  "effective_date": "2026-09-16",
  "canonical_ingestion_status": "NOT_INGESTED",
  "quality_status": "ROUTING_RESEARCH_SNAPSHOT_VALIDATED_WITH_PASS_THROUGH_LIMITATION",
  "active": true,
  "verified_at": "2026-10-01T11:41:35Z",
  "evidence": [
    "Official Jakarta transport authority publication dated 2026-09-25 states the current limited-operation windows and passenger-serving stations.",
    "The 11-station topology is preserved, while Matraman and Proklamasi are marked pass-through rather than fabricated as boarding stops.",
    "No open-data license or redistribution permission was found; operator-site automated retrieval is restricted."
  ]
}
