{
  "source_id": "7dd76c2e-814b-43ea-8bf4-5f471d0e38e4",
  "source_key": "krl-commuter-jabodetabek-official-timetable",
  "name": "Commuter Line Jabodetabek official timetable",
  "provider": "PT Kereta Commuter Indonesia (KAI Commuter)",
  "source_type": "PDF_TIMETABLE",
  "canonical_url": "https://www.commuterline.id/",
  "license_record": "data/licenses/phase-1-multi-operator-source-rights.md",
  "access_method": "OFFICIAL_WEB_PUBLICATION",
  "access_notes": "The official GAPEKA 2025 PDF resolved through commuterline.id to the official kci.id origin with HTTP 200 on 2026-10-01. The immutable local research copy is 2,395,416 bytes with SHA-256 5a5f067f1ac79e5b8a8aec8dbb613021678afef5b351fb9e42242b0fbbdc98a4. No explicit restriction on local noncommercial academic processing was found; automation and redistribution remain unknown.",
  "coverage_notes": "Official schedule publication for Commuter Line Jabodetabek; no redistribution-ready machine dataset was established.",
  "redistribution_rule": "No open-data or redistribution permission was located; do not redistribute or automate ingestion without permission.",
  "verification_status": "VERIFIED",
  "source_class": "C_OFFICIAL_REUSE_OR_AUTOMATION_UNCLEAR",
  "license_status": "UNKNOWN",
  "redistribution_status": "UNKNOWN",
  "automation_status": "UNKNOWN",
  "data_format": "PDF",
  "machine_readability": "DOCUMENT_ONLY",
  "schedule_status": "SCHEDULED_NO_OPEN_REDISTRIBUTION",
  "topology_status": "OFFICIAL_DOCUMENT",
  "geometry_status": "NOT_AVAILABLE",
  "service_calendar_status": "OFFICIAL_TIMETABLE_ONLY",
  "freshness": "Official GAPEKA 2025 PDF retrieved on 2026-10-01 and states service from 2025-02-01; no later official bulk timetable or permission record was established.",
  "effective_date": "2025-02-01",
  "canonical_ingestion_status": "NOT_INGESTED",
  "quality_status": "ROUTING_RESEARCH_SNAPSHOT_VALIDATED",
  "active": true,
  "verified_at": "2026-10-01T11:41:35Z",
  "evidence": [
    "Official KAI Commuter website publishes the GAPEKA 2025 Jabodetabek timetable.",
    "The official PDF was retrieved via an HTTP redirect to www.kci.id; the deterministic coordinate-aware parser validates 1,063 unique services, 17,786 stop-time cells, and zero rejected rows across 13 pages.",
    "No official open-data license or redistribution permission was found; raw and derived schedules remain local and Git-ignored."
  ]
}
