{
  "source_id": "5c7bd591-c538-4b71-9a52-100c1c3f3992",
  "source_key": "lrt-jabodebek-official-schedule",
  "name": "LRT Jabodebek official schedule and route information",
  "provider": "PT Kereta Api Indonesia (Persero)",
  "source_type": "HTML_TIMETABLE",
  "canonical_url": "https://lrtjabodebek.kai.id/jadwal-keberangkatan",
  "license_record": "data/licenses/phase-1-multi-operator-source-rights.md",
  "access_method": "OFFICIAL_WEB_PUBLICATION",
  "access_notes": "Official schedule and route pages returned HTTP 200 on 2026-10-01. The local ignored HTML snapshots contain 18 station tabs, weekday/holiday departure tables, and two official branches. No explicit restriction on local noncommercial academic processing was found; redistribution remains unknown and no open license is claimed.",
  "coverage_notes": "Official departure schedule and 18-station Cibubur/Bekasi route topology; no licensed bulk timetable or reusable geometry feed was established.",
  "redistribution_rule": "No open-data or redistribution permission was found; canonical ingestion is withheld.",
  "verification_status": "VERIFIED",
  "source_class": "C_OFFICIAL_REUSE_OR_AUTOMATION_UNCLEAR",
  "license_status": "UNKNOWN",
  "redistribution_status": "UNKNOWN",
  "automation_status": "UNKNOWN",
  "data_format": "HTML",
  "machine_readability": "STRUCTURED_WEB_PAGE",
  "schedule_status": "SCHEDULED_NO_OPEN_REDISTRIBUTION",
  "topology_status": "OFFICIAL_WEB_PAGE",
  "geometry_status": "NOT_AVAILABLE",
  "service_calendar_status": "WEB_SCHEDULE_ONLY",
  "freshness": "Official schedule and route pages retrieved on 2026-10-01; the pages expose current public information but no explicit dataset version/effective date.",
  "effective_date": null,
  "canonical_ingestion_status": "NOT_INGESTED",
  "quality_status": "ROUTING_RESEARCH_SNAPSHOT_VALIDATED",
  "active": true,
  "verified_at": "2026-10-01T11:41:35Z",
  "evidence": [
    "Official LRT Jabodebek schedule page returned HTTP 200 with text/html content.",
    "Official route page returned HTTP 200 and describes 18 stations across the Cibubur and Bekasi lines.",
    "No official open-data license or redistribution permission was found."
  ]
}
