{
  "source_id": "456d5566-e1bf-4f07-a6d5-f571aa24ba7a",
  "source_key": "mrt-jakarta-official-schedule",
  "name": "MRT Jakarta official departure schedule",
  "provider": "PT MRT Jakarta (Perseroda)",
  "source_type": "HTML_TIMETABLE",
  "canonical_url": "https://www.jakartamrt.co.id/id/jadwal-keberangkatan-mrt",
  "license_record": "data/licenses/phase-1-multi-operator-source-rights.md",
  "access_method": "OFFICIAL_WEB_PUBLICATION",
  "access_notes": "The official schedule route was reachable on 2026-10-01 but returned a JavaScript shell rather than a stable bulk schedule. Official public operating-pattern publications support a local frequency-derived research representation. The site disclaimer requires permission for commercial reuse; redistribution remains unknown, and no explicit restriction on local noncommercial academic processing was found.",
  "coverage_notes": "Official North-South line stations and departure information; no licensed bulk schedule or reusable geometry feed was established.",
  "redistribution_rule": "Redistribution and automated canonical ingestion remain unverified; published-content reuse is subject to the official disclaimer.",
  "verification_status": "VERIFIED",
  "source_class": "C_OFFICIAL_REUSE_OR_AUTOMATION_UNCLEAR",
  "license_status": "UNKNOWN",
  "redistribution_status": "UNKNOWN",
  "automation_status": "UNKNOWN",
  "data_format": "HTML",
  "machine_readability": "STRUCTURED_WEB_PAGE",
  "schedule_status": "SCHEDULED_NO_OPEN_REDISTRIBUTION",
  "topology_status": "OFFICIAL_WEB_PAGE",
  "geometry_status": "NOT_AVAILABLE",
  "service_calendar_status": "WEB_SCHEDULE_ONLY",
  "freshness": "Official schedule route rechecked on 2026-10-01; a current reusable machine snapshot was not established.",
  "effective_date": null,
  "canonical_ingestion_status": "NOT_INGESTED",
  "quality_status": "ROUTING_RESEARCH_SNAPSHOT_VALIDATED",
  "active": true,
  "verified_at": "2026-10-01T11:41:35Z",
  "evidence": [
    "Official MRT Jakarta schedule page returned HTTP 206 with text/html content.",
    "Official site disclaimer requires permission for commercial use of published content.",
    "No official open-data license or bulk machine-data endpoint was found."
  ]
}
