{
  "source_id": "e0e9bda7-4649-48c6-a64a-ebf421f48e61",
  "source_key": "transjakarta-official-gtfs-static",
  "name": "TransJakarta GTFS Static",
  "provider": "PT Transportasi Jakarta",
  "source_type": "GTFS_STATIC",
  "canonical_url": "https://ppid.transjakarta.co.id/informasi/berkala",
  "license_record": "data/licenses/transjakarta-gtfs-cc-by-4.0.md",
  "access_method": "HTTPS_DOWNLOAD",
  "access_notes": "Official download endpoint: https://gtfs.transjakarta.co.id/files/file_gtfs.zip",
  "coverage_notes": "Static scheduled TransJakarta service; category coverage is reported only from source GTFS route_desc values.",
  "redistribution_rule": "Sharing and adaptation, including commercial reuse, are permitted when CC BY 4.0 attribution conditions are met.",
  "verification_status": "VERIFIED",
  "source_class": "A_VERIFIED_OPEN_MACHINE_DATA",
  "license_status": "VERIFIED",
  "redistribution_status": "PERMITTED",
  "automation_status": "PERMITTED",
  "data_format": "GTFS ZIP",
  "machine_readability": "MACHINE_READABLE",
  "schedule_status": "FULL_SCHEDULED",
  "topology_status": "FULL_SCHEDULED",
  "geometry_status": "SOURCE_SHAPES",
  "service_calendar_status": "CALENDAR_AND_FREQUENCIES",
  "freshness": "Retrieved from the official endpoint on 2026-09-29; the feed does not provide feed_info.txt.",
  "effective_date": "2026-09-29",
  "canonical_ingestion_status": "COMPLETED",
  "quality_status": "WARNING_SOURCE_LIMITATIONS_ACCEPTED",
  "active": true,
  "official_download_url": "https://gtfs.transjakarta.co.id/files/file_gtfs.zip",
  "license_name": "CC BY 4.0",
  "license_url": "https://creativecommons.org/licenses/by/4.0/",
  "license_evidence_url": "https://ppid.transjakarta.co.id/informasi/berkala",
  "attribution_requirement": "Credit PT Transportasi Jakarta, link the CC BY 4.0 license, and indicate changes.",
  "verified_at": "2026-09-29T03:05:00Z",
  "evidence": [
    "The official PPID periodic-information page identifies the static GTFS dataset and links the download endpoint.",
    "The official PPID page states that the dataset is licensed under CC BY 4.0.",
    "The download resolved on the official gtfs.transjakarta.co.id origin with HTTP 200 and application/zip."
  ],
  "corroboration": [
    "https://mobilitydatabase.org/feeds/gtfs/mdb-1909",
    "https://www.transit.land/feeds/f-transjakarta~id"
  ],
  "current_manifest": "data/manifests/transjakarta-gtfs-63b4fb14d9af.json"
}
